{
  "contractVersion": "ecmascript-fixtures-1",
  "profileId": "EcmaScript2025",
  "dataId": "Unicode-16.0.0+Emoji-16.0",
  "cases": [
    {
      "id": "ECMA-C001",
      "capabilities": [
        "ES-001"
      ],
      "provenance": {
        "kind": "Specification",
        "uri": "https://tc39.es/ecma262/2025/multipage/text-processing.html",
        "clause": "22.2.3.2",
        "license": "Independently authored GregsEx MIT vector; upstream specification linked, not imported",
        "oracleId": null
      },
      "patternUnits": [
        97
      ],
      "inputUnits": [],
      "flags": "uv",
      "operation": "Parse",
      "lastIndexBefore": "0",
      "replacementUnits": null,
      "splitLimit": null,
      "expected": {
        "status": "InvalidSyntax",
        "lastIndexAfter": null,
        "matches": [],
        "texts": null,
        "error": {
          "code": "InvalidSyntax",
          "featureId": "ES-001",
          "location": "Flags",
          "offset": 1,
          "length": 1,
          "offsetUnit": "Utf16CodeUnits",
          "workConsumed": 0,
          "requiredCapacity": 0
        }
      },
      "startAt": 0,
      "destinationLength": null,
      "limits": null
    },
    {
      "id": "ECMA-C002",
      "capabilities": [
        "ES-002"
      ],
      "provenance": {
        "kind": "Specification",
        "uri": "https://tc39.es/ecma262/2025/multipage/text-processing.html",
        "clause": "22.2.2.3",
        "license": "Independently authored GregsEx MIT vector; upstream specification linked, not imported",
        "oracleId": null
      },
      "patternUnits": [
        97,
        124
      ],
      "inputUnits": [
        98
      ],
      "flags": "",
      "operation": "Exec",
      "lastIndexBefore": "0",
      "replacementUnits": null,
      "splitLimit": null,
      "expected": {
        "status": "Match",
        "lastIndexAfter": "0",
        "matches": [
          {
            "index": 0,
            "length": 0,
            "captures": [
              {
                "participated": true,
                "index": 0,
                "length": 0
              }
            ],
            "names": [],
            "hasIndices": false
          }
        ],
        "texts": null,
        "error": null
      },
      "startAt": 0,
      "destinationLength": null,
      "limits": null
    },
    {
      "id": "ECMA-C003",
      "capabilities": [
        "ES-003"
      ],
      "provenance": {
        "kind": "Specification",
        "uri": "https://tc39.es/ecma262/2025/multipage/text-processing.html",
        "clause": "22.2.2.7",
        "license": "Independently authored GregsEx MIT vector; upstream specification linked, not imported",
        "oracleId": null
      },
      "patternUnits": [
        40,
        63,
        105,
        58,
        97,
        41
      ],
      "inputUnits": [
        65
      ],
      "flags": "",
      "operation": "Exec",
      "lastIndexBefore": "0",
      "replacementUnits": null,
      "splitLimit": null,
      "expected": {
        "status": "Match",
        "lastIndexAfter": "0",
        "matches": [
          {
            "index": 0,
            "length": 1,
            "captures": [
              {
                "participated": true,
                "index": 0,
                "length": 1
              }
            ],
            "names": [],
            "hasIndices": false
          }
        ],
        "texts": null,
        "error": null
      },
      "startAt": 0,
      "destinationLength": null,
      "limits": null
    },
    {
      "id": "ECMA-C004",
      "capabilities": [
        "ES-004"
      ],
      "provenance": {
        "kind": "Specification",
        "uri": "https://tc39.es/ecma262/2025/multipage/text-processing.html",
        "clause": "22.2.2.5",
        "license": "Independently authored GregsEx MIT vector; upstream specification linked, not imported",
        "oracleId": null
      },
      "patternUnits": [
        94,
        40,
        97,
        124,
        40,
        98,
        41,
        41,
        42,
        36
      ],
      "inputUnits": [
        97
      ],
      "flags": "",
      "operation": "Exec",
      "lastIndexBefore": "0",
      "replacementUnits": null,
      "splitLimit": null,
      "expected": {
        "status": "Match",
        "lastIndexAfter": "0",
        "matches": [
          {
            "index": 0,
            "length": 1,
            "captures": [
              {
                "participated": true,
                "index": 0,
                "length": 1
              },
              {
                "participated": true,
                "index": 0,
                "length": 1
              },
              {
                "participated": false,
                "index": 0,
                "length": 0
              }
            ],
            "names": [],
            "hasIndices": false
          }
        ],
        "texts": null,
        "error": null
      },
      "startAt": 0,
      "destinationLength": null,
      "limits": null
    },
    {
      "id": "ECMA-C005",
      "capabilities": [
        "ES-005"
      ],
      "provenance": {
        "kind": "Specification",
        "uri": "https://tc39.es/ecma262/2025/multipage/text-processing.html",
        "clause": "22.2.1.1;22.2.7.2",
        "license": "Independently authored GregsEx MIT vector; upstream specification linked, not imported",
        "oracleId": null
      },
      "patternUnits": [
        40,
        63,
        60,
        120,
        62,
        97,
        41,
        124,
        40,
        63,
        60,
        120,
        62,
        98,
        41
      ],
      "inputUnits": [
        98
      ],
      "flags": "d",
      "operation": "Exec",
      "lastIndexBefore": "0",
      "replacementUnits": null,
      "splitLimit": null,
      "expected": {
        "status": "Match",
        "lastIndexAfter": "0",
        "matches": [
          {
            "index": 0,
            "length": 1,
            "captures": [
              {
                "participated": true,
                "index": 0,
                "length": 1
              },
              {
                "participated": false,
                "index": 0,
                "length": 0
              },
              {
                "participated": true,
                "index": 0,
                "length": 1
              }
            ],
            "names": [
              {
                "name": "x",
                "groupIds": [
                  1,
                  2
                ],
                "capture": {
                  "participated": true,
                  "index": 0,
                  "length": 1
                }
              }
            ],
            "hasIndices": true
          }
        ],
        "texts": null,
        "error": null
      },
      "startAt": 0,
      "destinationLength": null,
      "limits": null
    },
    {
      "id": "ECMA-C006",
      "capabilities": [
        "ES-006"
      ],
      "provenance": {
        "kind": "Specification",
        "uri": "https://tc39.es/ecma262/2025/multipage/text-processing.html",
        "clause": "22.2.2.7.2",
        "license": "Independently authored GregsEx MIT vector; upstream specification linked, not imported",
        "oracleId": null
      },
      "patternUnits": [
        94,
        40,
        97,
        124,
        40,
        98,
        41,
        41,
        92,
        50,
        36
      ],
      "inputUnits": [
        97
      ],
      "flags": "",
      "operation": "Exec",
      "lastIndexBefore": "0",
      "replacementUnits": null,
      "splitLimit": null,
      "expected": {
        "status": "Match",
        "lastIndexAfter": "0",
        "matches": [
          {
            "index": 0,
            "length": 1,
            "captures": [
              {
                "participated": true,
                "index": 0,
                "length": 1
              },
              {
                "participated": true,
                "index": 0,
                "length": 1
              },
              {
                "participated": false,
                "index": 0,
                "length": 0
              }
            ],
            "names": [],
            "hasIndices": false
          }
        ],
        "texts": null,
        "error": null
      },
      "startAt": 0,
      "destinationLength": null,
      "limits": null
    },
    {
      "id": "ECMA-C007",
      "capabilities": [
        "ES-007"
      ],
      "provenance": {
        "kind": "Specification",
        "uri": "https://tc39.es/ecma262/2025/multipage/text-processing.html",
        "clause": "22.2.2.4",
        "license": "Independently authored GregsEx MIT vector; upstream specification linked, not imported",
        "oracleId": null
      },
      "patternUnits": [
        40,
        63,
        60,
        61,
        40,
        91,
        97,
        98,
        93,
        43,
        41,
        40,
        91,
        98,
        99,
        93,
        43,
        41,
        41,
        36
      ],
      "inputUnits": [
        97,
        98,
        99
      ],
      "flags": "",
      "operation": "Exec",
      "lastIndexBefore": "0",
      "replacementUnits": null,
      "splitLimit": null,
      "expected": {
        "status": "Match",
        "lastIndexAfter": "0",
        "matches": [
          {
            "index": 3,
            "length": 0,
            "captures": [
              {
                "participated": true,
                "index": 3,
                "length": 0
              },
              {
                "participated": true,
                "index": 0,
                "length": 1
              },
              {
                "participated": true,
                "index": 1,
                "length": 2
              }
            ],
            "names": [],